### ISSUE TITLE
[e2eshould be able to preserve UDP traffic when server pod cycles for a ClusterIP service

### ISSUE THREAD

**Issue by dougsland** [kubernetes-sigs/kpng#174]

**Comment by dougsland** [comment]
If I understood correctly here the steps for the testing but still cannot reproduce:


`ClusterIP service/deployment:`
```
apiVersion: apps/v1
kind: Deployment
metadata:
  name: server-deployment
  labels:
    app: MyApp
spec:
  replicas: 1
  selector:
    matchLabels:
      app: MyApp
  template:
    metadata:
      labels:
        app: MyApp
    spec:
      containers:
      - name: agnhost
        image: k8s.gcr.io/e2e-test-images/agnhost:2.21
        args:
          - netexec
          - --http-port=80
          - --udp-port=80
        ports:
        - containerPort: 80
---
apiVersion: v1
kind: Service
metadata:
  name: clusterip-service
spec:
  type: ClusterIP
  selector:
    app: MyApp
  ports:
    - protocol: UDP
      port: 80
      targetPort: 80
```

`Creating the UDP service on port 80`
```
$ kubectl apply -f CLUSTERIP-svc-using-agnhost.yaml 
```

`Listing the service`
```
$ kubectl get svc -n default
default          clusterip-service   ClusterIP   10.96.203.66   <none>        80/UDP                   5h21m
```

`Listing the Deployment`
```
$ kubectl get deployment
NAME                READY   UP-TO-DATE   AVAILABLE   AGE
server-deployment   1/1     1            1           6h23m
```
`Listining the Endpoint`
```
$ kubectl get endpoints
default              clusterip-service       10.244.2.2:80  
```

`Creating, connecting into a UDP client and sending data to the UDP server clusterip address`
```
$ kubectl run clientudp -it --image k8s.gcr.io/e2e-test-images/agnhost:2.21 --command -- sh
# while true; do echo "hostname" | nc -u -w 5 10.96.203.66 80 ; sleep 1;  done
```

`[AT THE SAME time] Connecting into the UDP server and listening the port 80`

`1. Listening the server`
```
$ kubectl get pods -A | grep -i server
default              server-deployment-6978d8f8b9-tw6f6                         1/1 
```

`2. Connecting to the server`
```
$ kubectl iexec server-deployment-6978d8f8b9-tw6f6 
# apk update
# apk add tcpdump
# tcpdump `port 80`
23:30:30.876538 IP 10.244.1.5.60286 > server-deployment-6978d8f8b9-tw6f6.80: UDP, length 10
23:30:30.876664 IP server-deployment-6978d8f8b9-tw6f6.80 > 10.244.1.5.60286: UDP, length 34
23:30:36.880530 IP 10.244.1.5.58314 > server-deployment-6978d8f8b9-tw6f6.80: UDP, length 10
23:30:36.880713 IP server-deployment-6978d8f8b9-tw6f6.80 > 10.244.1.5.58314: UDP, length 34
```

**Comment by jayunit100** [comment]
if you recreate the pod a zillion times on a multi node cluster does it eventually fail? 

wonder if it depends on what node the pod is landing on , iirc the udp tests can be weird that way

**Comment by dougsland** [comment]
Following E2E, should be something like these steps listed below but still not able:

```
# STEP 1: Generate UDP service:
kubectl create -f "/tmp/udpserver-service-svc-udp-01-07-2022_01-16-12.yaml"

# STEP 2: Generate UDP client:
kubectl create -f "/tmp/udpclient-01-07-2022_01-16-12.yaml"

# STEP 3: Read the udp client logs to make sure it's sending the request
kubectl exec udpclient -- apk update
kubectl exec udpclient -- apk add tcpdump
kubectl exec udpclient -- tcpdump 'port 80'

# STEP 4: Generate deployment pod-server-1:
kubectl create -f "/tmp/udpserver-deployment-pod-server-1-01-07-2022_01-16-12.yaml"

# STEP 5: Check if the client request is arriving into pod-server-1
kubectl logs -f $(kubectl get pods | awk '/pod-server-1/ {print $1; exit}')

# STEP 6: Generate deployment pod-server-2
kubectl create -f "/tmp/udpserver-deployment-pod-server-2-01-07-2022_01-16-12.yaml"

# STEP 7: Delete backend pod-server-1
kubectl delete pod $(kubectl get pods | awk '/pod-server-1/ {print $1; exit}')
ADDITIONAL TEST: Instead of delete pod, scale down to 0 or delete deployment pod-server-1 

# STEP 8: Check that the pod-server-2 keeps receiving traffic UDP conntrack entries timeout is 30 sec by default
kubectl logs -f $(kubectl get pods | awk '/pod-server-2/ {print $1; exit}')
```

Files:
`/tmp/udpserver-service-svc-udp-01-07-2022_01-16-12.yaml`
```
---
apiVersion: v1
kind: Service
metadata:
  name: svc-udp
spec:
  type: ClusterIP
  selector:
    app: MyApp
  clusterIP: 10.96.237.45
  clusterIPs:
  - 10.96.237.45
  ports:
    - protocol: UDP
      port: 80
      targetPort: 80
```

`/tmp/udpclient-01-07-2022_01-16-12.yaml`
---
apiVersion: v1
kind: Pod
metadata:
  annotations:
  labels:
    run: udpclient
  name: udpclient
  namespace: default
spec:
  containers:
    - name: udpclient 
      command: ["/bin/bash", "-c", "--"]
      args: ["while true;do echo \"hostname\" | nc -u -w 5 10.96.237.45 80 ; sleep 1; done;"]
      image: k8s.gcr.io/e2e-test-images/agnhost:2.21
```

`/tmp/udpserver-deployment-pod-server-1-01-07-2022_01-16-12.yaml`
```
---
apiVersion: apps/v1
kind: Deployment
metadata:
  name: pod-server-1
  labels:
    app: MyApp
spec:
  replicas: 1
  selector:
    matchLabels:
      app: MyApp
  template:
    metadata:
      labels:
        app: MyApp
    spec:
      containers:
      - name: "agnhost"
        image: "k8s.gcr.io/e2e-test-images/agnhost:2.21"
        args:
          - netexec
          - --http-port=80
          - --udp-port=80
        ports:
        - containerPort: 80
```

`/tmp/udpserver-deployment-pod-server-2-01-07-2022_01-16-12.yaml`
```
---
apiVersion: apps/v1
kind: Deployment
metadata:
  name: pod-server-2
  labels:
    app: MyApp
spec:
  replicas: 1
  selector:
    matchLabels:
      app: MyApp
  template:
    metadata:
      labels:
        app: MyApp
    spec:
      containers:
      - name: "agnhost"
        image: "k8s.gcr.io/e2e-test-images/agnhost:2.21"
        args:
          - netexec
          - --http-port=80
          - --udp-port=80
        ports:
        - containerPort: 80
```

**Comment by dougsland** [comment]
> if you recreate the pod a zillion times on a multi node cluster does it eventually fail?
> 
> wonder if it depends on what node the pod is landing on , iirc the udp tests can be weird that way

Thanks Jay, I will try in a different environment for double check. :)

**Comment by jayunit100** [comment]
i just ran dougs repro and also, i see traffic rescued as well on kpng in iptables mode

**Comment by dougsland** [comment]
Just for the record, here the output from ginkgo:

```
[BeforeEach] [sig-network] Conntrack
  /workspace/src/k8s.io/kubernetes/_output/dockerized/go/src/k8s.io/kubernetes/test/e2e/framework/framework.go:185
STEP: Creating a kubernetes client
Jan  7 18:56:04.202: INFO: >>> kubeConfig: kubeconfig_tests.conf
STEP: Building a namespace api object, basename conntrack
W0107 18:56:04.255312 1448434 warnings.go:70] policy/v1beta1 PodSecurityPolicy is deprecated in v1.21+, unavailable in v1.25+
Jan  7 18:56:04.255: INFO: No PodSecurityPolicies found; assuming PodSecurityPolicy is disabled.
STEP: Waiting for a default service account to be provisioned in namespace
[BeforeEach] [sig-network] Conntrack
  /workspace/src/k8s.io/kubernetes/_output/dockerized/go/src/k8s.io/kubernetes/test/e2e/network/conntrack.go:96
[It] should be able to preserve UDP traffic when server pod cycles for a ClusterIP service
  /workspace/src/k8s.io/kubernetes/_output/dockerized/go/src/k8s.io/kubernetes/test/e2e/network/conntrack.go:206
STEP: creating a UDP service svc-udp with type=ClusterIP in conntrack-6269
STEP: creating a client pod for probing the service svc-udp
Jan  7 18:56:04.291: INFO: The status of Pod pod-client is Pending, waiting for it to be Running (with Ready = true)
Jan  7 18:56:06.295: INFO: The status of Pod pod-client is Running (Ready = true)
Jan  7 18:56:06.324: INFO: Pod client logs: Fri Jan  7 23:56:05 UTC 2022
Fri Jan  7 23:56:05 UTC 2022 Try: 1

Fri Jan  7 23:56:05 UTC 2022 Try: 2

Fri Jan  7 23:56:05 UTC 2022 Try: 3

Fri Jan  7 23:56:05 UTC 2022 Try: 4

Fri Jan  7 23:56:05 UTC 2022 Try: 5

Fri Jan  7 23:56:05 UTC 2022 Try: 6

Fri Jan  7 23:56:05 UTC 2022 Try: 7

STEP: creating a backend pod pod-server-1 for the service svc-udp
Jan  7 18:56:06.331: INFO: The status of Pod pod-server-1 is Pending, waiting for it to be Running (with Ready = true)
Jan  7 18:56:08.335: INFO: The status of Pod pod-server-1 is Running (Ready = true)
STEP: waiting up to 3m0s for service svc-udp in namespace conntrack-6269 to expose endpoints map[pod-server-1:[80]]
Jan  7 18:56:08.344: INFO: successfully validated that service svc-udp in namespace conntrack-6269 exposes endpoints map[pod-server-1:[80]]
STEP: checking client pod connected to the backend 1 on Node IP 172.18.0.3
STEP: creating a second backend pod pod-server-2 for the service svc-udp
Jan  7 18:56:18.365: INFO: The status of Pod pod-server-2 is Pending, waiting for it to be Running (with Ready = true)
Jan  7 18:56:20.370: INFO: The status of Pod pod-server-2 is Running (Ready = true)
Jan  7 18:56:20.372: INFO: Cleaning up pod-server-1 pod
Jan  7 18:56:20.379: INFO: Waiting for pod pod-server-1 to disappear
Jan  7 18:56:20.389: INFO: Pod pod-server-1 no longer exists
STEP: waiting up to 3m0s for service svc-udp in namespace conntrack-6269 to expose endpoints map[pod-server-2:[80]]
Jan  7 18:56:20.397: INFO: successfully validated that service svc-udp in namespace conntrack-6269 exposes endpoints map[pod-server-2:[80]]
STEP: checking client pod connected to the backend 2 on Node IP 172.18.0.3
Jan  7 18:57:20.422: INFO: Pod client logs: Fri Jan  7 23:56:05 UTC 2022
Fri Jan  7 23:56:05 UTC 2022 Try: 1

Fri Jan  7 23:56:05 UTC 2022 Try: 2

Fri Jan  7 23:56:05 UTC 2022 Try: 3

Fri Jan  7 23:56:05 UTC 2022 Try: 4

Fri Jan  7 23:56:05 UTC 2022 Try: 5

Fri Jan  7 23:56:05 UTC 2022 Try: 6

Fri Jan  7 23:56:05 UTC 2022 Try: 7

Fri Jan  7 23:56:10 UTC 2022 Try: 8
pod-server-1
Fri Jan  7 23:56:15 UTC 2022 Try: 9
pod-server-1
Fri Jan  7 23:56:20 UTC 2022 Try: 10
pod-server-1
Fri Jan  7 23:56:25 UTC 2022 Try: 11

Fri Jan  7 23:56:30 UTC 2022 Try: 12

Fri Jan  7 23:56:35 UTC 2022 Try: 13

Fri Jan  7 23:56:40 UTC 2022 Try: 14

Fri Jan  7 23:56:45 UTC 2022 Try: 15

Fri Jan  7 23:56:50 UTC 2022 Try: 16

Fri Jan  7 23:56:55 UTC 2022 Try: 17

Fri Jan  7 23:57:00 UTC 2022 Try: 18

Fri Jan  7 23:57:05 UTC 2022 Try: 19

Fri Jan  7 23:57:10 UTC 2022 Try: 20

Fri Jan  7 23:57:15 UTC 2022 Try: 21

Fri Jan  7 23:57:20 UTC 2022 Try: 22

Jan  7 18:57:20.423: FAIL: Failed to connect to backend 2

Full Stack Trace
k8s.io/kubernetes/test/e2e.RunE2ETests(0xc000eb8180)
	_output/dockerized/go/src/k8s.io/kubernetes/test/e2e/e2e.go:130 +0x36c
k8s.io/kubernetes/test/e2e.TestE2E(0xc000eb8180)
	_output/dockerized/go/src/k8s.io/kubernetes/test/e2e/e2e_test.go:136 +0x2b
testing.tRunner(0xc000eb8180, 0x72d3060)
	/usr/local/go/src/testing/testing.go:1193 +0xef
created by testing.(*T).Run
	/usr/local/go/src/testing/testing.go:1238 +0x2b3
[AfterEach] [sig-network] Conntrack
  /workspace/src/k8s.io/kubernetes/_output/dockerized/go/src/k8s.io/kubernetes/test/e2e/framework/framework.go:186
Jan  7 18:57:20.424: INFO: Waiting up to 3m0s for all (but 0) nodes to be ready
STEP: Destroying namespace "conntrack-6269" for this suite.


• Failure [76.228 seconds]
[sig-network] Conntrack
/workspace/src/k8s.io/kubernetes/_output/dockerized/go/src/k8s.io/kubernetes/test/e2e/network/common/framework.go:23
  should be able to preserve UDP traffic when server pod cycles for a ClusterIP service [It]
  /workspace/src/k8s.io/kubernetes/_output/dockerized/go/src/k8s.io/kubernetes/test/e2e/network/conntrack.go:206

  Jan  7 18:57:20.423: Failed to connect to backend 2

  /workspace/src/k8s.io/kubernetes/_output/dockerized/go/src/k8s.io/kubernetes/vendor/github.com/onsi/ginkgo/internal/leafnodes/runner.go:113
------------------------------
{"msg":"FAILED [sig-network] Conntrack should be able to preserve UDP traffic when server pod cycles for a ClusterIP service","total":-1,"completed":0,"skipped":171,"failed":1,"failures":["[sig-network] Conntrack should be able to preserve UDP traffic when server pod cycles for a ClusterIP service"]}
Jan  7 18:57:20.431: INFO: Running AfterSuite actions on all nodes
Jan  7 18:57:20.431: INFO: Running Cleanup Action: k8s.io/kubernetes/test/e2e/storage.glob..func17.2
Jan  7 18:57:20.431: INFO: Running Cleanup Action: k8s.io/kubernetes/test/e2e/storage.glob..func8.2
Jan  7 18:57:20.431: INFO: Running Cleanup Action: k8s.io/kubernetes/test/e2e/storage.glob..func7.2
Jan  7 18:57:20.431: INFO: Running Cleanup Action: k8s.io/kubernetes/test/e2e/storage/vsphere.glob..func17.3
Jan  7 18:57:20.431: INFO: Running Cleanup Action: k8s.io/kubernetes/test/e2e/storage/vsphere.glob..func9.2
Jan  7 18:57:20.431: INFO: Running Cleanup Action: k8s.io/kubernetes/test/e2e/storage/vsphere.glob..func4.2
Jan  7 18:57:20.431: INFO: Running Cleanup Action: k8s.io/kubernetes/test/e2e/storage/vsphere.glob..func1.3


Jan  7 18:56:04.422: INFO: Running AfterSuite actions on all nodes
Jan  7 18:56:04.422: INFO: Running Cleanup Action: k8s.io/kubernetes/test/e2e/storage.glob..func17.2
Jan  7 18:56:04.422: INFO: Running Cleanup Action: k8s.io/kubernetes/test/e2e/storage.glob..func8.2
Jan  7 18:56:04.422: INFO: Running Cleanup Action: k8s.io/kubernetes/test/e2e/storage.glob..func7.2
Jan  7 18:56:04.422: INFO: Running Cleanup Action: k8s.io/kubernetes/test/e2e/storage/vsphere.glob..func17.3
Jan  7 18:56:04.422: INFO: Running Cleanup Action: k8s.io/kubernetes/test/e2e/storage/vsphere.glob..func9.2
Jan  7 18:56:04.422: INFO: Running Cleanup Action: k8s.io/kubernetes/test/e2e/storage/vsphere.glob..func4.2
Jan  7 18:56:04.422: INFO: Running Cleanup Action: k8s.io/kubernetes/test/e2e/storage/vsphere.glob..func1.3
Jan  7 18:57:20.453: INFO: Running AfterSuite actions on node 1
Jan  7 18:57:20.453: INFO: Skipping dumping logs from cluster



Summarizing 1 Failure:

[Fail] [sig-network] Conntrack [It] should be able to preserve UDP traffic when server pod cycles for a ClusterIP service 
/workspace/src/k8s.io/kubernetes/_output/dockerized/go/src/k8s.io/kubernetes/vendor/github.com/onsi/ginkgo/internal/leafnodes/runner.go:113

Ran 1 of 6432 Specs in 77.335 seconds
FAIL! -- 0 Passed | 1 Failed | 0 Pending | 6431 Skipped
```

**Comment by dougsland** [comment]
Reproduced the report, the trick is add in the `nc` from `UDPCLIENT POD` the `SourcePort`
==========================================================

# STEP 1: Generate UDP service:
```kubectl create -f "/tmp/udpserver-service-svc-udp-01-07-2022_19-48-58.yaml"```

`cat /tmp/udpserver-service-svc-udp-01-07-2022_19-48-58.yaml`
```
---
apiVersion: v1
kind: Service
metadata:
  name: svc-udp
spec:
  type: ClusterIP
  selector:
    app: MyApp
  clusterIP: 10.96.237.45
  clusterIPs:
  - 10.96.237.45
  ports:
    - protocol: UDP
      port: 80
      targetPort: 80
```


# STEP 2: Generate UDP client:
```kubectl create -f "/tmp/udpclient-01-07-2022_19-48-58.sk8s"```

`cat /tmp/udpclient-01-07-2022_19-48-58.yaml`
```
---
apiVersion: v1
kind: Pod
metadata:
  annotations:
  labels:
    run: udpclient
  name: udpclient
  namespace: default
spec:
  containers:
    - name: udpclient 
      command: ["/bin/bash", "-c", "--"]
      args: ["date; for i in $(seq 1 3000); do echo \"$(date) Try: ${i}\"; echo hostname | nc -u -w 5 -p 12345 10.96.237.45 80; echo; done"]
      image: k8s.gcr.io/e2e-test-images/agnhost:2.21
```
# STEP 3: Read the udp client logs to make sure it's sending the request
```
kubectl exec udpclient -- apk update
kubectl exec udpclient -- apk add tcpdump
kubectl exec udpclient -- tcpdump 'port 80'
```

# STEP 4: Generate deployment pod-server-1:
```
kubectl create -f "/tmp/udpserver-deployment-pod-server-1-01-07-2022_19-48-58.yaml"
```
`$ cat /tmp/udpserver-deployment-pod-server-1-01-07-2022_19-48-58.yaml`
```
---
apiVersion: apps/v1
kind: Deployment
metadata:
  name: pod-server-1
  labels:
    app: MyApp
spec:
  replicas: 1
  selector:
    matchLabels:
      app: MyApp
  template:
    metadata:
      labels:
        app: MyApp
    spec:
      containers:
      - name: "agnhost"
        image: "k8s.gcr.io/e2e-test-images/agnhost:2.21"
        args:
          - netexec
          - --http-port=80
          - --udp-port=80
        ports:
        - containerPort: 80
```

# STEP 5: Check if the client request is arriving into pod-server-1
```
kubectl logs -f $(kubectl get pods | awk '/pod-server-1/ {print $1; exit}')
```

# STEP 6: Generate deployment pod-server-2
kubectl create -f "/tmp/udpserver-deployment-pod-server-2-01-07-2022_19-48-58.sk8s"

`$ cat /tmp/udpserver-deployment-pod-server-2-01-07-2022_19-48-58.sk8s`
```
---
apiVersion: apps/v1
kind: Deployment
metadata:
  name: pod-server-2
  labels:
    app: MyApp
spec:
  replicas: 1
  selector:
    matchLabels:
      app: MyApp
  template:
    metadata:
      labels:
        app: MyApp
    spec:
      containers:
      - name: "agnhost"
        image: "k8s.gcr.io/e2e-test-images/agnhost:2.21"
        args:
          - netexec
          - --http-port=80
          - --udp-port=80
        ports:
        - containerPort: 80
```
# STEP 7: Scale down backend pod-server-1
```
kubectl scale deployment/pod-server-1 --replicas=0
```

# STEP 8: Check that the pod-server-2 keeps receiving traffic UDP conntrack entries timeout is 30 sec by default
```
kubectl logs -f $(kubectl get pods | awk '/pod-server-2/ {print $1; exit}')
```

**Comment by dougsland** [comment]
Few notes:

- Tested against `kube-proxy` after `pod-server1` is down... In 10sec approx `pod-server2` start responding.
- `kpng` **IN IPTABLES** mode** works like `kube-proxy`
- `kpng` **IN IPVS mode** takes approx. **10min** to `pod-server2` start responding, the E2E test timeout is less than.
- Mental note: At this moment, `kube-proxy` or `kpng` doesn't execute round robin algorithm if there are two deployments in the same port (i.e: 80) responding behind a ClusterIP.

@jayunit100 @knabben @qabpea see previous comment for the reproducer.

**Comment by qabpea** [comment]
This is a direct result of #157 https://github.com/kubernetes-sigs/kpng/issues/157. The connection/flow is not removed from the conntracker until the traffic stops

**Comment by knabben** [comment]
> This is a direct result of #157 . The connection/flow is not removed from the conntracker until the traffic stops

Can confirm the stale connections are not being cleaned on iptables backend:

https://github.com/kubernetes-sigs/kpng/blob/5c135f5b1f3b0c09dbd5851bb30d50be04d0be18/backends/iptables/iptables.go#L327

**Comment by qabpea** [comment]
We have a test in the e2e test that triggers the problem. What we need is not another test, but rather a setup that can be used to confirm, identify and later verify that the problem is solved. For this issue and a few others, what we need is to look inside the conntrack tables and study what is installed.

The use case tested here is clearly described at https://github.com/kubernetes/kubernetes/blob/master/test/e2e/network/conntrack.go#L48-L65

**Comment by dougsland** [comment]
Just for the record, seems other people reached this upstream: https://github.com/kubernetes/kubernetes/issues/106274

**Comment by dougsland** [comment]
1. Monitor in the **kind nodes** for the source connection:
`shell 1`
```
#kind-node> watch conntrack -L -p udp --orig-port-src=12345` 
udp      17 115 src=10.244.2.2 dst=10.96.237.45 sport=12345 dport=80 src=10.244.2.4 dst=10.244.2.2 sport=80 dport=12345
```

2-  Scale down pod-server-1 and noticed that `pod-server-2` is not responding any UDP request.
```
# kubectl scale deployment/pod-server-1 --replicas=0
```

Logs not showing anything in pod-server-2:
```
# kubectl logs -f $(kubectl get pods | awk '/pod-server-2/ {print $1; exit}')
```

2. Delete the conntrack entry in the **same kind node**:
`shell-2`
```
#kind-node> conntrack -D conntrack --proto udp                 
udp      17 118 src=10.244.2.2 dst=10.96.237.45 sport=12345 dport=80 src=10.244.2.3 dst=10.244.2.2 sport=80 dport=12345 [ASSURED] mark=0 use=1
conntrack v1.4.6 (conntrack-tools): 1 flow entries have been deleted.
```

That at this moment the logs of `pod-server-2` **start responding/showing**
```
# kubectl logs -f $(kubectl get pods | awk '/pod-server-2/ {print $1; exit}')
```

**Comment by qabpea** [comment]
There is one little peculiarity when the endpoint goes from zero to one in conjunction with multi port service that we did not discuss.
Any given endpoint can provide one or more of the ports, there is no guarantee that all ports defined by the service is provided by a POD/endpoint.
The "black hole" connection entries will have the service address, proto (most likely UDP) and port as "destination".
A multi port services can there fore have several groupings of connection entries. Which group(s) that should have the entries removed depends on which ports that the new endpoint provides. 
The fact is that the "service" therefor can provide services on a subset of the ports, there can still be ports which no endpoint available for even though there are endpoints for other ports.

To test this requires a multiport service and at least two deployments that only provide a subset of the ports.
This test can be made arbitrarily complex

**Comment by qabpea** [comment]
I assume the node port has the same problem
[fail-7.txt](https://github.com/kubernetes-sigs/kpng/files/7871930/fail-7.txt)
[fail-5.txt](https://github.com/kubernetes-sigs/kpng/files/7871935/fail-5.txt)

**Comment by polefishu** [comment]
> stale

I can't reproduce the problem by following these steps in my v1.16.6 cluster.
Does this take many tries to reproduce?

**Comment by dougsland** [comment]
Hi @polefishu ,

> > [#174 (comment)](https://github.com/kubernetes-sigs/kpng/issues/174#issuecomment-10078726397
> 
> @dougsland
> 
> I can't reproduce the problem by following these steps in my v1.16.6 cluster. Does this take many tries to reproduce?

Should be very straightforward to reproduce using `kpng`. I guess your cluster in version `v1.16.6` is using `kube-proxy` not `kpng`. You could double check using this command:

```
$ kubectl get pods -n kube-system | grep -i kube-proxy
kube-proxy-4ddhn                           1/1     Running   1          184d        <------------ using kube-proxy
kube-proxy-m6pb5                           1/1     Running   1          184d
kube-proxy-n7cgn                           1/1     Running   1          184d
kube-proxy-sz67d                           1/1     Running   1          184d
kube-proxy-vvn2g                           1/1     Running   2          184d
```
For `kpng` you will use the same command but replacing `kube-proxy` with `kpng`

If you would like to give it a test please follow the steps:
```
# git clone https://github.com/kubernetes-sigs/kpng.git && cd kpng
# ./hack/test_e2e.sh -i ipv4 -b iptables -d
steps mentioned in comment#174 
```

Please let me know if you have any question.

**Comment by polefishu** [comment]
Hi @dougsland, thanks for reply, my cluster is using kube-proxy.

In my production environment, sometimes there will be a black hole of udp connection as mentioned above.
But I can't reproduce it in the test environment.

**Comment by dougsland** [comment]
> Hi @dougsland, thanks for reply, my cluster is using kube-proxy.
> 
> In my production environment, sometimes there will be a black hole of udp connection as mentioned above. But I can't
> reproduce it in the test environment.

The people that are working in the `kpng` mostly are the persons supporting `kube-proxy` upstream so you are welcome to share here the steps (if you have) to reproduce your issue so we make sure we cover it in the `next generation` of kube-proxy.

However, I would recommend to open an issue as well in kubernetes project as it's the right place for `kube-proxy` issues.

**Comment by qabpea** [comment]
The new conntrack support made by @mcluseau should make this a lot more straight forward to implement

**Comment by dougsland** [comment]
See also: https://github.com/openshift/network-tools/pull/55

**Comment by qabpea** [comment]
step 1-8 are good, what is missing is to dump the conntrack content at a few places:
1: After step 1 (what does it look before sending anything)
2: After step 2 (how is flow to service with no endpoint handled)
3: After Step 5 Is any black hole flow removed and is there a new flow to the endpoint
4: After Step 7 Is the old flow removed after the endpoint is gone?
5: After Step 8 Is there a new flow towards the other endpoint
